{
  "schema_version": "3.2-g.1",
  "dataset_id": "msc",
  "canonical_name": "Multi-Session Chat (MSC)",
  "role": "Lifecycle, provenance, multi-session memory, reuse, and longitudinal behavior. MSC is NOT forced into the strict-TSR / task-QA framework unless and until a legitimate task/workload layer exists for it. Its primary Phase 3 use is exercising the memory lifecycle, provenance, and reuse machinery across sessions -- not literal-answer evaluation. (Quoted/paraphrased from phase3/specification/DATASET_CAPABILITY_MATRIX.md section 2.3.)",
  "registry_reference": {
    "manifest_file": "data/metadata/dataset_manifest.json",
    "dataset_key": "msc",
    "record_count_reference": "data/metadata/phase2_freeze_manifest.json: memory_foundation.record_counts.msc = 227185 (matches the actual line count of data/processed/msc/memory_records.jsonl, verified in this stage)."
  },
  "source_reference": {
    "processed_files": [
      { "path": "data/processed/msc/memory_records.jsonl", "total_lines": 227185 },
      { "path": "data/processed/msc/task_records.jsonl", "total_lines": 0, "note": "File exists on disk (verified via ls -la) and is exactly 0 bytes -- an empty placeholder, not a missing file. This positively confirms 'no native task layer' for MSC rather than leaving it an inference." }
    ]
  },
  "inspection_method": {
    "description": "Read-only inspection performed in Phase 3.2-G: first 2 lines of memory_records.jsonl read in full for field-shape confirmation; a deterministic 500-line prefix sample of memory_records.jsonl checked programmatically for memory_id uniqueness; task_records.jsonl confirmed to exist as a 0-byte file via `ls -la` (not merely 'no lines read'); the full memory_records.jsonl file (all 227185 lines) was grep-searched for the literal field names parent_ids/equivalent_to/conflicts_with/superseded_by, with zero matches; preprocessing/datasets/msc.py was read to corroborate that the Phase 1 loader code itself has no task/evidence/gold-answer field production logic (grep for evidence_memory_ids/task_id/gold matched zero files under preprocessing/datasets/ other than locomo.py and longmemeval.py).",
    "sample_based": true,
    "sample_sizes": {
      "memory_records_uniqueness_sample": 500,
      "memory_records_field_name_grep": 227185
    }
  },
  "memory_availability": {
    "stable_id": {
      "status": "AVAILABLE",
      "reason": "Sampled records carry a `memory_id` field (24-hex-char identifier), same convention as the other three datasets.",
      "grounding": "data/processed/msc/memory_records.jsonl:memory_id"
    },
    "unique_id": {
      "status": "AVAILABLE",
      "reason": "500/500 sampled memory_id values were unique in the prefix sample.",
      "grounding": "data/processed/msc/memory_records.jsonl (500-line uniqueness sample)"
    },
    "content_available": {
      "status": "AVAILABLE",
      "reason": "Sampled records have non-empty `content` strings (e.g. 'I need some advice on where to go on vacation...').",
      "grounding": "data/processed/msc/memory_records.jsonl:content"
    },
    "timestamped": {
      "status": "NOT_PROVIDED_BY_SOURCE",
      "reason": "Sampled records carry `source_timestamp: null` and `timestamp_type: \"unavailable\"` -- MSC has no absolute timestamps, only relative inter-session structure (session_1, session_2, ...), matching data/metadata/dataset_manifest.json's known_limitations note ('No absolute timestamps, only relative inter-session gaps').",
      "grounding": "data/processed/msc/memory_records.jsonl:source_timestamp,timestamp_type"
    },
    "session_linked": {
      "status": "AVAILABLE",
      "reason": "Sampled records carry `session_id` (e.g. 'session_1') and `conversation_id` (e.g. 'train:ordered_3537').",
      "grounding": "data/processed/msc/memory_records.jsonl:session_id,conversation_id"
    },
    "typed_foundation_or_derived": {
      "status": "NOT_PROVIDED_BY_SOURCE",
      "reason": "No explicit type tag exists; per phase3/schemas/memory_schema.md, Phase 1/2 UMR-sourced records are foundation memories by construction, but no field asserts this explicitly."
    },
    "explicit_parent_ids_present": {
      "status": "NOT_PROVIDED_BY_SOURCE",
      "reason": "Whole-file grep of all 227185 lines for 'parent_ids' returned zero matches.",
      "grounding": "data/processed/msc/memory_records.jsonl (whole-file grep, 227185 lines)"
    }
  },
  "workload_availability": {
    "explicit_task_records": {
      "status": "NOT_PROVIDED_BY_SOURCE",
      "reason": "data/processed/msc/task_records.jsonl is a 0-byte file on disk (confirmed via `ls -la`, not merely absent from a directory listing). This is a positive confirmation of 'no native task layer' matching DATASET_CAPABILITY_MATRIX.md's 'No native task layer' row for MSC.",
      "grounding": "data/processed/msc/task_records.jsonl (file size confirmed 0 bytes)"
    },
    "separate_from_memory": {
      "status": "UNAVAILABLE",
      "reason": "There is no workload layer at all to be 'separate from memory' -- the question does not apply because the antecedent (a task layer existing) is false, per explicit_task_records above.",
      "grounding": "data/processed/msc/task_records.jsonl (0 bytes)"
    },
    "query_field": {
      "status": "NOT_PROVIDED_BY_SOURCE",
      "reason": "No query/question field exists anywhere; corroborated by preprocessing/datasets/msc.py containing no query/task-construction logic (grep for 'task_id'/'evidence_memory_ids'/'gold' across preprocessing/datasets/ matched only locomo.py and longmemeval.py)."
    },
    "gold_answer_field": {
      "status": "NOT_PROVIDED_BY_SOURCE",
      "reason": "No answer field exists anywhere for MSC; same corroborating evidence as query_field."
    },
    "task_id_field": {
      "status": "NOT_PROVIDED_BY_SOURCE",
      "reason": "No task_id field exists anywhere for MSC."
    },
    "session_or_conversation_id": {
      "status": "AVAILABLE",
      "reason": "Memory-level session_id/conversation_id fields exist and are populated (see memory_availability.session_linked) -- this is a memory-layer capability, independent of the (absent) task layer, and is exactly the kind of structure DATASET_CAPABILITY_MATRIX.md calls MSC's 'primary use case' for (repeated-interaction / lifecycle validation across sessions).",
      "grounding": "data/processed/msc/memory_records.jsonl:session_id,conversation_id"
    }
  },
  "evidence_availability": {
    "status": "NOT_PROVIDED_BY_SOURCE",
    "reason": "There is no task/workload layer (task_records.jsonl is 0 bytes) and therefore no gold-evidence-ID field exists anywhere for MSC. This is the single most important field for the Strict-TSR audit: MSC positively lacks it, which is why Strict TSR is UNAVAILABLE (not SUPPORTED_WITH_ADAPTER) in metric_support below -- there is no adapter that manufactures gold evidence where none was ever defined by the source.",
    "grounding": "data/processed/msc/task_records.jsonl (0 bytes); data/processed/msc/memory_records.jsonl (whole-file grep for evidence-shaped field names, no matches)"
  },
  "answer_availability": {
    "status": "NOT_PROVIDED_BY_SOURCE",
    "reason": "No gold-answer field exists anywhere for MSC, for the same reason as evidence_availability.",
    "grounding": "data/processed/msc/task_records.jsonl (0 bytes)"
  },
  "provenance_availability": {
    "status": "AVAILABLE",
    "reason": "Sampled memory records carry a full `provenance` object (conversation_id, session_id, source_dataset, source_file, source_record_id, turn_id, extraction_pipeline_version) -- this is exactly the substrate DATASET_CAPABILITY_MATRIX.md calls MSC's 'primary use case' for provenance validation. Note this is the foundation-memory source pointer, not a derived-memory parent-edge structure (see explicit_parent_ids_present, NOT_PROVIDED_BY_SOURCE).",
    "grounding": "data/processed/msc/memory_records.jsonl:provenance"
  },
  "lineage_availability": {
    "status": "NOT_PROVIDED_BY_SOURCE",
    "reason": "No parent_ids edges exist anywhere in the file (whole-file grep, 0 matches); there is no lineage graph to walk today. IMPORTANT DISCREPANCY NOTE: DATASET_CAPABILITY_MATRIX.md lists 'Lifecycle suitability: Primary use case' for MSC, which this profile does NOT contradict -- but at the raw current-file level, MSC's lineage-graph richness (zero explicit parent edges) is identical to all three other datasets (also zero). The matrix's 'primary use case' framing is about MSC's strong repeated-interaction/session structure being well-suited for lifecycle/provenance/reuse machinery once a memory-creation policy starts producing derived memories and events -- it is not a claim that parent_ids/lineage data already exists in the current substrate. This profile flags this distinction explicitly per the 3.2-G task brief's cross-check instruction, rather than silently resolving it either way.",
    "grounding": "data/processed/msc/memory_records.jsonl (whole-file grep, 227185 lines)"
  },
  "equivalence_availability": {
    "status": "NOT_PROVIDED_BY_SOURCE",
    "reason": "Whole-file grep of all 227185 lines for 'equivalent_to' returned zero matches.",
    "grounding": "data/processed/msc/memory_records.jsonl (whole-file grep, 227185 lines)"
  },
  "temporal_information": {
    "kind": "ORDERED_SEQUENCE_ONLY",
    "reason": "source_timestamp is null and timestamp_type is 'unavailable' in sampled records; ordering is available only via session_id (session_1..session_5) and event_order/turn_id within a session, not absolute or relative-duration timestamps. Matches data/metadata/dataset_manifest.json's known_limitations note verbatim."
  },
  "metric_support": {